{"command": "engines", "engines": [{"available": true, "display_name": "OmniParser", "name": "omniparser"}, {"available": true, "display_name": "UIED", "name": "uied"}], "error": null, "meta": {"cli_version": "1.0.0", "command": "engines", "omniparser_version": "b0d5c9f-dirty", "processing_time_ms": 16247, "request_id": "cd553666c81d4305ab9f431b62f88985", "timestamp_utc": "2026-03-22T23:14:13Z"}, "request_id": "cd553666c81d4305ab9f431b62f88985", "schema_version": "1.1", "status": "success", "timestamp_utc": "2026-03-22T23:14:13Z", "warnings": []}
